{
  "schema_version": "1.2.2",
  "policy_version": "automation-policy-2026-01",
  "job_id": "77777777-7777-4777-8777-777777777777",
  "job_type": "entity_fetch",
  "priority": 50,
  "status": "running",
  "scope": { "family": "pharmacy", "country": "om" },
  "idempotency_key": "entity-fetch-example-0001",
  "requested_by": { "actor_type": "scheduler", "actor_id": "scheduler-1" },
  "attempt_count": 1,
  "max_attempts": 3,
  "lease": {
    "owner": "worker-1",
    "token_hash": "aaaaaaaaaaaaaaaaaaaaaaaaaaaaaaaaaaaaaaaaaaaaaaaaaaaaaaaaaaaaaaaa",
    "lease_epoch": 1,
    "expires_at": "2026-07-15T08:02:00Z",
    "heartbeat_at": "2026-07-15T08:00:30Z"
  },
  "budget": {
    "currency": "USD",
    "price_version": "prices-2026-07-15",
    "estimated": 0.2,
    "reserved": 0.3,
    "hard_limit": 0.5,
    "actual": 0,
    "enforcement": "allowed"
  },
  "created_at": "2026-07-15T08:00:00Z",
  "started_at": "2026-07-15T08:00:10Z"
}
